{
  "enabled": true,
  "autoStart": true,
  "storageDir": "./data",
  "logLevel": "warn",
  "botAgent": "ToBe/wechat-adapter",
  "receive": {
    "messageTypes": ["text", "image", "voice"]
  },
  "events": {
    "dedupeTtlMs": 3600000,
    "messageCacheTtlMs": 3600000,
    "maxCachedMessages": 500
  }
}
